{
  "note": "Situations and the applicability entry ids that apply to each, under the International rules. The two-subject sibling of applicability-fixtures.json, which is untouched and stays the one-subject contract (REQ-VERIFY-1, REQ-CAT-5). A situation addresses each vessel's facts through the subject namespace of docs/identifiers.md: <subject>:<class>:<key>, subject in {self, other, pair}.",
  "schema": "situation/1",
  "status": "pencil",
  "adr": "0005",
  "requirements": ["REQ-CAT-4", "REQ-CAT-5", "REQ-CAT-6", "REQ-CAT-7"],
  "jurisdiction": "intl",
  "expect_form": {
    "note": "An element of `expect` is either a bare entry id or an object {\"entry\": <id>, \"modality\": <modality>} naming the modality that entry is expected to carry. The two forms are interchangeable and a bare id asserts nothing about modality, so the published one-subject fixtures remain valid unedited while Q-5's three modality-only gates (rule:23a_ii, rule:26b_ii, rule:30c) become fixturable.",
    "bare": "rule:23a_i",
    "with_modality": {
      "entry": "rule:23a_ii",
      "modality": "modality:may"
    }
  },
  "case_status": {
    "note": "`status` says whether a case asserts anything. An `illustrative` case fixes the shape of the situation record and the namespace before the entries it describes exist; its `expect` is empty and the suite checks its shape and namespace resolution only. A case becomes `binding` when the entries it names exist, and only then does it join the fixture replay. The three illustrative cases this file opened with -- a crossing, a narrow-channel head-on and a 13(d) latch -- are all binding as of the classification PR, which is what they were written to become. The status stays in the schema because the next family of norms will want it again.",
    "values": ["illustrative", "binding"]
  },
  "cases": [
    {
      "name": "crossing: self power-driven, other fine on the starboard bow",
      "status": "binding",
      "narrative": "Two power-driven vessels in sight of one another, other bearing 040 relative at 3 nm on a steady bearing and crossing right to left ahead. Self has the other on her own starboard side, so self is the give-way vessel under Rule 15 and Rule 16 governs the action; the other is stand-on under Rule 17. Rule 15 is not transcribed yet, so this asserts nothing. Binding since Rules 7(d), 13, 14 and 15 landed: rule:15a:crossing is the encounter, rule:15a:keep_out_of_the_way is the role, rule:7d_i is the steady bearing, and rule:8f_iii is Rule 8(f)(iii) denying the stand-on vessel any privilege from a shall-not-impede duty she is not owed. Rules 16 and 17 are `category:conduct` and are still not modelled.",
      "expect": [
        "rule:4",
        "rule:11",
        "rule:7d_i",
        "rule:8f_iii",
        "rule:15a:crossing",
        "rule:15a:keep_out_of_the_way"
      ],
      "situation": {
        "self": {
          "fact": {
            "fact:propulsion": "propulsion:power",
            "fact:activity": "activity:none",
            "fact:position": "position:underway",
            "fact:making_way": true,
            "fact:length_m": 15
          },
          "kin": {
            "kin:position": {
              "latitude": 50,
              "longitude": -1.4
            },
            "kin:heading_deg": 0,
            "kin:sog_kn": 12,
            "kin:rot_deg_min": 0,
            "kin:dynamics": "dynamics:yacht"
          },
          "geo": {
            "geo:rel_bearing_deg": 40
          },
          "hist": {
            "hist:was_overtaking": false,
            "hist:latched_at_s": null
          }
        },
        "other": {
          "fact": {
            "fact:propulsion": "propulsion:power",
            "fact:activity": "activity:none",
            "fact:position": "position:underway",
            "fact:making_way": true,
            "fact:length_m": 40
          },
          "kin": {
            "kin:position": {
              "latitude": 50.0383,
              "longitude": -1.35
            },
            "kin:heading_deg": 300,
            "kin:sog_kn": 7.83,
            "kin:rot_deg_min": 0,
            "kin:dynamics": "dynamics:cargo"
          },
          "geo": {
            "geo:rel_bearing_deg": 280
          },
          "hist": {
            "hist:was_overtaking": false,
            "hist:latched_at_s": null
          }
        },
        "pair": {
          "geo": {
            "geo:range_m": 5556,
            "geo:bearing_change_deg_min": 0,
            "geo:cpa_m": 1,
            "geo:tcpa_s": 1023,
            "geo:in_sight": true,
            "geo:risk_of_collision": true
          }
        }
      },
      "roles": {
        "self": [
          {
            "role": "role:give-way",
            "by": "rule:15a:keep_out_of_the_way"
          }
        ],
        "other": [
          {
            "role": "role:stand-on",
            "by": "rule:15a:keep_out_of_the_way"
          }
        ]
      }
    },
    {
      "name": "narrow channel: head-on round a bend, bank 100 m to starboard",
      "status": "binding",
      "narrative": "The R1 illustration of ADR 0005 sec. 5 and the proposal's sec. 4. Self keeps to the starboard side of a narrow channel per Rule 9(a); a vessel cuts the bend and is head-on at 800 m. Rule 14(a) requires each to alter to starboard, and the bank is 100 m to starboard of self. Every compliant plan grounds or collides; a port alteration passes starboard-to-starboard and breaches 14(a). The value of the case here is not the region finding, which belongs to colregs-engine -- it is that the situation record can carry it at all. Binding now: `pair:env:narrow_channel` is the fact the recorded gap asked for and rule:14b is the classification. Neither 9(b) nor 9(c) applies from self's side -- she is 24 m and power-driven -- so the narrow channel changes no entry here and is stated because it is true, not to select one. Recast on a steady bearing when the consistency check landed (Q-48): the other now bears 357 relative, three degrees on self's port bow, and has self 3.6 degrees on her own starboard bow, which at 12 and 10 knots is a collision course. The 3/8 starboard-to-starboard pair the case opened with passed at 74 m with the bearing changing four and a half degrees a minute, and no positive speeds make it steady -- two vessels each with the other to starboard are never on a collision course. The dilemma is unchanged: a starboard alteration is into the bank.",
      "expect": ["rule:4", "rule:11", "rule:7d_i", "rule:8f_iii", "rule:14b"],
      "situation": {
        "self": {
          "fact": {
            "fact:propulsion": "propulsion:power",
            "fact:activity": "activity:none",
            "fact:position": "position:underway",
            "fact:making_way": true,
            "fact:length_m": 24
          },
          "kin": {
            "kin:position": {
              "latitude": 50,
              "longitude": -1.4
            },
            "kin:heading_deg": 90,
            "kin:sog_kn": 12,
            "kin:rot_deg_min": 0,
            "kin:dynamics": "dynamics:ferry"
          },
          "geo": {
            "geo:rel_bearing_deg": 357
          },
          "hist": {
            "hist:was_overtaking": false,
            "hist:latched_at_s": null
          }
        },
        "other": {
          "fact": {
            "fact:propulsion": "propulsion:power",
            "fact:activity": "activity:none",
            "fact:position": "position:underway",
            "fact:making_way": true,
            "fact:length_m": 18
          },
          "kin": {
            "kin:position": {
              "latitude": 50.00038,
              "longitude": -1.38882
            },
            "kin:heading_deg": 263.4,
            "kin:sog_kn": 10,
            "kin:rot_deg_min": 0,
            "kin:dynamics": "dynamics:unknown"
          },
          "geo": {
            "geo:rel_bearing_deg": 3.6
          },
          "hist": {
            "hist:was_overtaking": false,
            "hist:latched_at_s": null
          }
        },
        "pair": {
          "geo": {
            "geo:range_m": 800,
            "geo:bearing_change_deg_min": 0,
            "geo:cpa_m": 0,
            "geo:tcpa_s": 71,
            "geo:in_sight": true,
            "geo:risk_of_collision": true
          },
          "env": {
            "env:narrow_channel": true,
            "env:traffic_lane": false
          }
        }
      }
    },
    {
      "name": "13(d) latch: an overtaking whose bearing has drawn out to a crossing",
      "status": "binding",
      "narrative": "Self came up on the other vessel from abaft her beam and is overtaking. The bearing has since drawn out: self now bears 250 relative from the other, just outside Rule 13(b)'s 112.5-247.5 sector, so the instantaneous geometry alone would reclassify this as a crossing with the other vessel give-way. Rule 13(d) forbids exactly that, and self:hist:was_overtaking is the fact that carries it. This is the case that makes history a class rather than a note. Binding: rule:13d holds the classification at overtaking on the strength of the latch alone, and rule:15a:crossing is absent -- not because the geometry excludes it, which it does not, but because its `self:hist:was_overtaking: false` gate does. That absence is the whole content of 13(d). The pair numbers were re-derived from the kinematics when the consistency check landed (Q-48): at 400 m abeam with five knots between them the bearing is changing at 24 degrees a minute and the closest approach is already past, so 7(d)(i)'s steady-bearing ground is not available and `rule:7d_i` left the expectation. `geo:risk_of_collision` is a supplied judgement and stays true -- nothing in this package may deny a risk, and 13(d) does not read one.",
      "expect": ["rule:4", "rule:11", "rule:8f_iii", "rule:13a", "rule:13d"],
      "situation": {
        "self": {
          "fact": {